{"affected_case_ids":["CV1-fo4-dx10-v1.decode.fo4-dds-base-fo4-dx10-v1-mixed-v1.mixed.pc-v1","CV1-fo4-dx10-v1.encode.fo4-dds-base-fo4-dx10-v1-mixed-v1.mixed.pc-v1"],"approval":{"approved_at":"2026-09-08T23:41:49.647861Z","approver":"evildarkarchon","decision":"approved"},"configuration":{"case_configuration":{"DdsTarget":"PC","compatibility_profile":"none","description":"Sequential safe-default configuration; no Compatibility Profile; Windows-1252 names; exact DdsTarget=PC","kind":"configuration","name_encoding":"windows-1252","provenance":{"creator":"JBSA project contributors","spdx_license":"CC0-1.0"},"version":1,"workers":1},"generator_configuration":{"recipe":"base-fo4-dx10-v1-mixed"},"specification_set":[{"path":"docs/spec/requirements.yaml","sha256":"659dcf5dc4bfcf70a0cb7f17436426e3521865e0798996ec75d6b3725f846f97"},{"path":"docs/spec/bsarch-cli.md","sha256":"b57a1ba9e40a2178a7cce9e53af66f32bcbe829358024a752e94c257956df0c7"},{"path":"docs/spec/codecs.md","sha256":"a5e29d203b9b5d7cee807e9426d86fa5625216ac18ad339d5cd1cfe5b4facdb8"},{"path":"docs/spec/compatibility-profiles.md","sha256":"0ecaa3f12fac00b31832363750263a2d0560ab8848c04a29c9e8ae5554d34bd7"},{"path":"docs/spec/compliance.md","sha256":"f0e46e64cf891f6dc4f55482bc287d28ddb737df13f4c20f5eee5a997a9c4359"},{"path":"docs/spec/conformance-v1.md","sha256":"3700a944098890cccda7f3f529b643abb1bf13522b0079f6a34bdc5cc5696c10"},{"path":"docs/spec/distribution.md","sha256":"d06e7bc32b0c88e26159e39114a61545feb7b33856b0f69e069ed5bb9fa3a8a4"},{"path":"docs/spec/execution-model.md","sha256":"6411e7f4934ef6c2253ee5db73de7524616499069013a008d9f11b35df6f84bf"},{"path":"docs/spec/formats/dds-ba2.md","sha256":"89be9f4703eb946a6dc2447441a5bfbfa4124fa2a0deec667039eb7d51f492df"},{"path":"docs/spec/formats/dds-payload.md","sha256":"db1c9ef24ac6b70177a204772ed5640e69925980717f08083bbb4019132d159e"},{"path":"docs/spec/formats/detection.md","sha256":"3a27a373015f77b0d6e2d5325ff935b40026051fe782e0d4a16eb56c4e0345eb"},{"path":"docs/spec/formats/general-ba2.md","sha256":"f027220dccaaf7f8e0cbeedca5b4e5bd7f39171ba183318f0d31e6c08ddc2540"},{"path":"docs/spec/formats/tes3-bsa.md","sha256":"af9e12d19e34ac1af24e4ec31426d1d7a686386972c98cb300c53d8d054f74f7"},{"path":"docs/spec/formats/versioned-bsa.md","sha256":"aaf584a7fcb49a2a03a599bca0b1c8257c27e4c567b3d8940582367de0dca98b"},{"path":"docs/spec/io-and-publication.md","sha256":"08066d775d365f912b5e084db164f469fbd9588d1c3d31561b4c1efcb2932c6c"},{"path":"docs/spec/library-interface.md","sha256":"a9bbc52eda28c1d061caba2c8bf2e205df1f489750e94d4670802641affa372f"},{"path":"docs/spec/modules-and-build.md","sha256":"bc857ed5584d5092b47eceafc3ddcd6ce6479f799ba96c35c4608a23ffdfe4de"},{"path":"docs/spec/operation-semantics.md","sha256":"8f2f331dd6e70394d3836bc3c8ec388bc67c272eba80369499e9dcfc89747130"},{"path":"docs/spec/performance-v1.md","sha256":"0ac0168c8356ac41418c314d4c8a0ee79599330df83d800a5c17e9d67a9e7639"},{"path":"docs/spec/README.md","sha256":"8b5d50ce46f1b9d6efcf10a8b2d9bcb81aeaecc49b1740173303058e711eb4f7"},{"path":"docs/spec/release-gates.md","sha256":"0a6573320a858ab2595eebaa208af0929a49afe3378c6a4d0feaf91e003cfaea"},{"path":"docs/spec/scope.md","sha256":"10f1c0dda648c0547009112c394dca9feae29088df497ac84e53fab588e9e9c5"}]},"generator":{"id":"jbsa-dds-cv1-review-v1","version":"1"},"golden_id":"cv1-fo4-dx10-v1-encode-fo4-dds-base-fo4-dx10-v1-mixed-v1-mixed-pc-v1","new_sha256":"b5c21f5453f3a73a99394a54cbc850dbd566cb1628b6522ca483d54bc1c63073","old_sha256":"0000000000000000000000000000000000000000000000000000000000000000","oracle_sha256":null,"rationale":"First independently authored expectations for new DDS successor identities.","schema_version":1,"semantic_difference":"Materialize DDS wire, canonical header, chunk bytes, warnings and rejection observations.","source_fixture_sha256s":["bf06eb1082c9f828e4ba8552fbd39ae398d42d25fc49fb6866676116da8a2912"],"status":"approved"}