{"affected_case_ids":["CV1-bsa-068.decode.bsa-068-stored-v1.stored.standard-v1","CV1-bsa-068.encode.bsa-068-stored-v1.stored.standard-v1","CV1-bsa-068.scenario.bsa-068-scenario-bsa-automatic-flags-v1.stored.standard-v1","CV1-bsa-068.scenario.bsa-068-scenario-bsa-dds-empty-stem-v1.stored.standard-v1","CV1-bsa-068.scenario.bsa-068-scenario-bsa-embedded-068-v1.stored.standard-v1","CV1-bsa-068.scenario.bsa-068-scenario-bsa-hash-collisions-v1.stored.standard-v1","CV1-bsa-068.scenario.bsa-068-scenario-bsa-name-flags-v1.stored.standard-v1","CV1-bsa-068.scenario.bsa-068-scenario-input-nested-v1.stored.standard-v1","CV1-bsa-068.scenario.bsa-068-scenario-names-ascii-lowercase-v1.stored.standard-v1","CV1-bsa-068.scenario.bsa-068-scenario-names-case-and-separators-v1.stored.standard-v1","CV1-bsa-068.scenario.bsa-068-scenario-names-nonascii-lowercase-v1.stored.standard-v1","CV1-bsa-068.scenario.bsa-068-scenario-names-normalized-rejections-v1.stored.standard-v1","CV1-bsa-068.scenario.bsa-068-scenario-names-undecodable-components-v1.stored.standard-v1","CV1-bsa-068.scenario.bsa-068-scenario-names-unmappable-encode-v1.stored.standard-v1","CV1-bsa-068.scenario.bsa-068-scenario-source-later-part-collision-v1.stored.standard-v1","CV1-bsa-068.scenario.bsa-068-scenario-source-sharing-v1.stored.standard-v1","CV1-bsa-068.scenario.bsa-068-scenario-source-split-names-v1.stored.standard-v1"],"approval":{"decision":"approved","approved_at":"2026-09-11T04:55:16.3646354+00:00","approver":"maintainer via Codex"},"configuration":{"case_configuration":{"DdsTarget":null,"compatibility_profile":"none","description":"Sequential safe-default configuration; no Compatibility Profile; Windows-1252 names","kind":"configuration","name_encoding":"windows-1252","provenance":{"creator":"JBSA project contributors","spdx_license":"CC0-1.0"},"version":1,"workers":1},"generator_configuration":{"command":"python build/generate-bsa68-cv1-fixtures.py --output <empty-directory>","options":{"representation":"lowercase hexadecimal plus LF","wire_sha256":"696cd7ddc9c0b7e6cf353e3f8f278320af4670db3772e506d2b80b8df28858d4","wire_size":"1132"},"procedure":"Two meshes entries a.nif=A repeated 1024 times and b.nif=000102ff; codec=stored; RFC1950 literal-only streams; version104 automatic archive flags"},"specification_set":[{"path":"docs/spec/requirements.yaml","sha256":"ce657328ef2b57a34987306d6cc6fd1413fe57bf0a652175af7aab709f861512"},{"path":"docs/spec/bsarch-cli.md","sha256":"f0c2f5addc72bae5cc35cc26f40efea853528cbdeb62cca49b3f4cd0604797eb"},{"path":"docs/spec/codecs.md","sha256":"a5e29d203b9b5d7cee807e9426d86fa5625216ac18ad339d5cd1cfe5b4facdb8"},{"path":"docs/spec/compatibility-profiles.md","sha256":"bdfd7d55307654567a4ecb82131c7283a91f4b8e16469f7bf0ff07768adcb496"},{"path":"docs/spec/compliance.md","sha256":"f0e46e64cf891f6dc4f55482bc287d28ddb737df13f4c20f5eee5a997a9c4359"},{"path":"docs/spec/conformance-v1.md","sha256":"54980ecaed6d3ef2eb1f9c5a69c249f45c2af2f235fa4a6bf1106581e39f8868"},{"path":"docs/spec/distribution.md","sha256":"d06e7bc32b0c88e26159e39114a61545feb7b33856b0f69e069ed5bb9fa3a8a4"},{"path":"docs/spec/execution-model.md","sha256":"6411e7f4934ef6c2253ee5db73de7524616499069013a008d9f11b35df6f84bf"},{"path":"docs/spec/formats/dds-ba2.md","sha256":"89be9f4703eb946a6dc2447441a5bfbfa4124fa2a0deec667039eb7d51f492df"},{"path":"docs/spec/formats/dds-payload.md","sha256":"aff99cd84bbec8b0b9e423985b9c65a7689999f3d57fe2de8b6c1823d597e780"},{"path":"docs/spec/formats/detection.md","sha256":"3a27a373015f77b0d6e2d5325ff935b40026051fe782e0d4a16eb56c4e0345eb"},{"path":"docs/spec/formats/general-ba2.md","sha256":"f027220dccaaf7f8e0cbeedca5b4e5bd7f39171ba183318f0d31e6c08ddc2540"},{"path":"docs/spec/formats/tes3-bsa.md","sha256":"af9e12d19e34ac1af24e4ec31426d1d7a686386972c98cb300c53d8d054f74f7"},{"path":"docs/spec/formats/versioned-bsa.md","sha256":"aaf584a7fcb49a2a03a599bca0b1c8257c27e4c567b3d8940582367de0dca98b"},{"path":"docs/spec/io-and-publication.md","sha256":"08066d775d365f912b5e084db164f469fbd9588d1c3d31561b4c1efcb2932c6c"},{"path":"docs/spec/library-interface.md","sha256":"025b2dfb2edd9f755a9eb036684809dfd7db3d9e50a46401e056a33dc963ad56"},{"path":"docs/spec/modules-and-build.md","sha256":"bc857ed5584d5092b47eceafc3ddcd6ce6479f799ba96c35c4608a23ffdfe4de"},{"path":"docs/spec/operation-semantics.md","sha256":"8f2f331dd6e70394d3836bc3c8ec388bc67c272eba80369499e9dcfc89747130"},{"path":"docs/spec/performance-v1.md","sha256":"682b43d3bfbfb9d3c9201947c940726cbe5ff62d9d23ec9367d34a1e02036770"},{"path":"docs/spec/README.md","sha256":"8b5d50ce46f1b9d6efcf10a8b2d9bcb81aeaecc49b1740173303058e711eb4f7"},{"path":"docs/spec/release-gates.md","sha256":"898eefd4d9d5e2142bcb494a096431c28267cb81f0fd5c17f40c031d618ba864"},{"path":"docs/spec/scope.md","sha256":"02362fb20062654afad46a1b5b9546b269b87d601d408fe1c95c1cf942b1ad7d"}]},"generator":{"id":"jbsa-bsa068-cv1-fixture-generator","version":"1"},"golden_id":"bsa-068-scenario-bsa-068-scenario-bsa-automatic-flags-v1-stored-standard-v1","new_sha256":"13833ad7c6c0d95e2ba030a9076cf86206da2758e47b20bbee5a0c24e0e06be5","old_sha256":"0000000000000000000000000000000000000000000000000000000000000000","oracle_sha256":"4c34fe4173a2bd04ba52d5a6357348256ee424573785085fdafaab524cf7b0c2","rationale":"First independently authored expected bytes for successor cases; old zero digest denotes no previously accepted golden.","schema_version":1,"semantic_difference":"Replaces missing evidence with exact wire semantics, diagnostic fields, payload digests and required local differential observations.","source_fixture_sha256s":["50e503625ac08c688a130eb4918297c5dbbe04ac1abf98a85d5024c0470314ee"],"status":"approved"}